{
  "schema_version": "0.4.0",
  "document_type": "asset_lifecycle_extension",
  "document_status": "structure_defined_no_data_imported",
  "generated_at": "2026-08-07T00:00:00Z",
  "extends": "homestead.primary.v0_3",
  "merge_target": "data/homestead_asset_register.yaml",
  "source_document": "Homestead_Digital_Twin_Software_Design_Document_v0.3.md",
  "work_queue_item": "49.7",
  "purpose": "Defines the commercial and lifecycle structure that hangs off each asset identity: ownership, CAPEX reference, warranty, replacement cost, service life, spare parts and end of life. The design package contains no prices, dates, serial numbers or warranty records, so this document imports nothing. Its value is that the shape exists and the gaps are explicit.",
  "import_instructions": {
    "summary": "Every monetary and date field below is null and every data_status is not_yet_imported. A human must supply the real records; nothing here may be filled in by inference.",
    "required_from_the_owner": [
      "A CAPEX reference for each purchased asset: purchase order, invoice number or accounting line item.",
      "Acquisition cost and currency, and the purchase date, from the invoice rather than from memory.",
      "The in-service date, which is often months after the purchase date and drives warranty and depreciation.",
      "Serial number or asset tag, recorded as an external identifier on the asset, not as its canonical ID.",
      "Warranty terms, warranty start basis and expiry date, including any extended coverage purchased later.",
      "Current replacement cost, refreshed periodically, since replacement cost is not acquisition cost.",
      "Expected service life in years, with the basis: manufacturer statement, insurer requirement or policy.",
      "Spare-parts holdings for each asset: part identity, quantity on hand, storage location and reorder point.",
      "End-of-life and disposal expectations for anything containing batteries, refrigerant or hazardous material."
    ],
    "import_rules": [
      "Set data_status to imported on a record only when every field on that record has been supplied or explicitly marked not applicable. Partial imports keep data_status at partially_imported.",
      "Correct ownership_state by hand where it is wrong. The derived value comes from register status alone and register status is a design-progress field, not a proof of possession.",
      "Never write a price, date or serial number into this document that is not copied from a real record.",
      "Physical replacement does not create a new lifecycle record for the functional position (SDD rule 25.3.6). The replacement equipment gets its own asset and its own lifecycle record, linked by a replaces relationship.",
      "Spare parts are recorded as a list of holdings against the asset that consumes them, not as assets."
    ],
    "known_blockers": [
      "The energy capacity revision is unresolved, so no PV, inverter or battery CAPEX figure can be correct yet. See docs/design-decisions/DD-001-energy-capacity-revision.md.",
      "The property has not been confirmed, so land, site works, well drilling and trenching have no scope.",
      "Generator, battery chemistry, controller family and historian are all unselected, so their CAPEX lines do not exist."
    ]
  },
  "ownership_derivation": {
    "rule": "ownership_state is derived from the register status field and from nothing else. No source document in this package asserts possession of any equipment, so no record is marked owned on any other basis.",
    "status_to_ownership": {
      "concept": "planned",
      "planned": "planned",
      "procured": "owned",
      "installed": "owned",
      "commissioned": "owned",
      "active": "owned",
      "degraded": "owned",
      "failed": "owned",
      "maintenance": "owned",
      "reserve": "owned",
      "retired": "owned"
    },
    "observed_result": "No asset in the v0.3 register carries a status of procured, installed, commissioned or active. Only the two reserve-status records derive to owned. The source material describes some rack hardware as existing, but the register does not record that, and this document will not add it.",
    "counts": {
      "owned": 2,
      "planned": 88,
      "leased": 0,
      "unknown": 0
    }
  },
  "field_semantics": {
    "ownership_state": "owned, planned, leased or unknown. Derived; correct it by hand on import.",
    "acquisition_status": "Whether a purchase record exists to import.",
    "capex_reference": "Accounting handle for the purchase. Null until imported.",
    "purchase_date": "Invoice date. Null until imported.",
    "in_service_date": "Date the asset began operating. Drives warranty and depreciation. Null until imported.",
    "warranty_status": "not_yet_imported, active, expired, void or not_applicable.",
    "replacement_cost_status": "Replacement cost is what it costs to replace today, not what was paid.",
    "expected_service_life_years": "Planning life for renewal budgeting. Null until an owner or vendor states it.",
    "spare_parts": "Holdings that serve this asset: part identity, quantity, location, reorder point.",
    "spares_policy_required": "Derived from register criticality: critical and life-safety assets need a decision.",
    "end_of_life_status": "Retirement, disposal and replacement expectation.",
    "data_status": "not_yet_imported, partially_imported or imported."
  },
  "coverage": {
    "records": 90,
    "source_register_assets": 90,
    "extension_assets_not_covered": "Water extension assets in data/water_assets.yaml are all status concept and receive lifecycle records when that extension is merged into the base register.",
    "spares_policy_required_count": 48
  },
  "records": {
    "site.site.primary.01": {
      "asset_name": "Primary Homestead Site",
      "domain": "site",
      "asset_class": "site",
      "register_status": "concept",
      "criticality": "critical",
      "ownership_state": "planned",
      "ownership_basis": "derived_from_register_status",
      "acquisition_status": "concept_only_not_specified",
      "capex_reference": null,
      "acquisition_cost": null,
      "acquisition_currency": null,
      "purchase_date": null,
      "in_service_date": null,
      "warranty_status": "not_yet_imported",
      "warranty_expires": null,
      "replacement_cost": null,
      "replacement_cost_status": "not_yet_imported",
      "expected_service_life_years": null,
      "service_life_basis": "not_yet_imported",
      "spare_parts": [],
      "spare_parts_status": "not_yet_imported",
      "spares_policy_required": true,
      "end_of_life_status": "not_applicable_not_yet_in_service",
      "disposal_plan_status": "not_yet_imported",
      "data_status": "not_yet_imported",
      "open_fields": [
        "ownership_state_confirmation",
        "capex_reference",
        "acquisition_cost",
        "purchase_date",
        "warranty_terms",
        "warranty_expires",
        "replacement_cost",
        "expected_service_life_years",
        "spare_parts_inventory",
        "critical_spare_holding_decision"
      ],
      "notes": [
        "The property itself. Acquisition of land is a CAPEX line of its own and precedes every other record here."
      ]
    },
    "site.geographic_zone.agrivoltaic_field.01": {
      "asset_name": "Agrivoltaic Field",
      "domain": "site",
      "asset_class": "geographic_zone",
      "register_status": "planned",
      "criticality": "important",
      "ownership_state": "planned",
      "ownership_basis": "derived_from_register_status",
      "acquisition_status": "not_yet_imported",
      "capex_reference": null,
      "acquisition_cost": null,
      "acquisition_currency": null,
      "purchase_date": null,
      "in_service_date": null,
      "warranty_status": "not_yet_imported",
      "warranty_expires": null,
      "replacement_cost": null,
      "replacement_cost_status": "not_yet_imported",
      "expected_service_life_years": null,
      "service_life_basis": "not_yet_imported",
      "spare_parts": [],
      "spare_parts_status": "not_yet_imported",
      "spares_policy_required": false,
      "end_of_life_status": "not_applicable_not_yet_in_service",
      "disposal_plan_status": "not_yet_imported",
      "data_status": "not_yet_imported",
      "open_fields": [
        "ownership_state_confirmation",
        "capex_reference",
        "acquisition_cost",
        "purchase_date",
        "warranty_terms",
        "warranty_expires",
        "replacement_cost",
        "expected_service_life_years",
        "spare_parts_inventory"
      ],
      "notes": []
    },
    "site.geographic_zone.orchard.01": {
      "asset_name": "Orchard and Food Forest Zone",
      "domain": "site",
      "asset_class": "geographic_zone",
      "register_status": "planned",
      "criticality": "important",
      "ownership_state": "planned",
      "ownership_basis": "derived_from_register_status",
      "acquisition_status": "not_yet_imported",
      "capex_reference": null,
      "acquisition_cost": null,
      "acquisition_currency": null,
      "purchase_date": null,
      "in_service_date": null,
      "warranty_status": "not_yet_imported",
      "warranty_expires": null,
      "replacement_cost": null,
      "replacement_cost_status": "not_yet_imported",
      "expected_service_life_years": null,
      "service_life_basis": "not_yet_imported",
      "spare_parts": [],
      "spare_parts_status": "not_yet_imported",
      "spares_policy_required": false,
      "end_of_life_status": "not_applicable_not_yet_in_service",
      "disposal_plan_status": "not_yet_imported",
      "data_status": "not_yet_imported",
      "open_fields": [
        "ownership_state_confirmation",
        "capex_reference",
        "acquisition_cost",
        "purchase_date",
        "warranty_terms",
        "warranty_expires",
        "replacement_cost",
        "expected_service_life_years",